{
 "ticker": "7418",
 "company": "香繼光",
 "legal_name": "香繼光股份有限公司",
 "source": {
  "doc_type": "公開說明書",
  "doc_label": "補辦公開發行",
  "filed_month": "2026-06",
  "citation_url": "https://doc.twse.com.tw/server-java/t57sb01?step=9&kind=B&co_id=7418&filename=202606_7418_B06.pdf",
  "filename": "202606_7418_B06.pdf",
  "text_sha256": "daa4dc4d89722b29bf53d4b0cb3b9472ba6f30ad133d4f112a243efdb62206c0",
  "text_path": "research-site/ops/full-coverage-p2/prospectus/cache/daa4dc4d89722b29bf53d4b0cb3b9472ba6f30ad133d4f112a243efdb62206c0.txt"
 },
 "facts": [
  {
   "id": "7418-PS-01",
   "field": "revenue_mix",
   "statement": "114年度本集團餐飲銷售收入為新臺幣1,081,624千元，營業比重為63.87%。",
   "period": "114年度",
   "page": 35,
   "excerpts": [
    "(2)營業比重 \n單位：新臺幣千元；% \n年度 \n主要產品 \n113年度 114 年度 \n金額 比率(%) 金額 比率(%)",
    "餐飲銷售收入 988,445 63.28% 1,081,624 63.87%"
   ],
   "attribution": "公司公開說明書揭露",
   "verification": {
    "status": "PASS",
    "checks": {
     "source_hash": true,
     "excerpt_found": true,
     "page_match": true,
     "numbers_supported": true,
     "identity": true
    },
    "notes": [],
    "verified_at": "2026-10-26T02:21:20+00:00"
   }
  },
  {
   "id": "7418-PS-02",
   "field": "revenue_mix",
   "statement": "114年度本集團商品買賣收入為新臺幣550,017千元，營業比重為32.48%。",
   "period": "114年度",
   "page": 35,
   "excerpts": [
    "(2)營業比重 \n單位：新臺幣千元；% \n年度 \n主要產品 \n113年度 114 年度 \n金額 比率(%) 金額 比率(%)",
    "商品買賣收入 513,176 32.86% 550,017 32.48%"
   ],
   "attribution": "公司公開說明書揭露",
   "verification": {
    "status": "PASS",
    "checks": {
     "source_hash": true,
     "excerpt_found": true,
     "page_match": true,
     "numbers_supported": true,
     "identity": true
    },
    "notes": [],
    "verified_at": "2026-10-26T02:21:20+00:00"
   }
  },
  {
   "id": "7418-PS-03",
   "field": "revenue_mix",
   "statement": "114年度本集團其他收入主要為加盟金、權利金及營運管理費等，金額為新臺幣61,866千元，營業比重為3.65%。",
   "period": "114年度",
   "page": 35,
   "excerpts": [
    "(2)營業比重 \n單位：新臺幣千元；% \n年度 \n主要產品 \n113年度 114 年度 \n金額 比率(%) 金額 比率(%)",
    "其他 60,360 3.86% 61,866 3.65%",
    "其他主要係加盟金、\n權利金及營運管理費收入。"
   ],
   "attribution": "公司公開說明書揭露",
   "verification": {
    "status": "PASS",
    "checks": {
     "source_hash": true,
     "excerpt_found": true,
     "page_match": true,
     "numbers_supported": true,
     "identity": true
    },
    "notes": [],
    "verified_at": "2026-10-26T02:21:20+00:00"
   }
  },
  {
   "id": "7418-PS-04",
   "field": "business_scope",
   "statement": "本集團主要經營連鎖餐飲品牌，提供臺灣傳統小吃鹽酥雞、餐食及飲料等產品。",
   "period": "截至115年度公開說明書刊印日",
   "page": 35,
   "excerpts": [
    "本集團所營業務主要為經營連鎖餐飲品牌，提供臺灣傳統小吃鹽酥雞、\n餐食及飲料等多元產品線"
   ],
   "attribution": "公司公開說明書揭露",
   "verification": {
    "status": "PASS",
    "checks": {
     "source_hash": true,
     "excerpt_found": true,
     "page_match": true,
     "numbers_supported": true,
     "identity": true
    },
    "notes": [],
    "verified_at": "2026-10-26T02:21:20+00:00"
   }
  },
  {
   "id": "7418-PS-05",
   "field": "products",
   "statement": "本集團以「繼光香香雞」為核心品牌，提供現點現炸的雞肉產品。",
   "period": "截至115年度公開說明書刊印日",
   "page": 46,
   "excerpts": [
    "本集團以經營「繼光香香雞」為核心品牌，提供現點現炸的雞肉產品"
   ],
   "attribution": "公司公開說明書揭露",
   "verification": {
    "status": "PASS",
    "checks": {
     "source_hash": true,
     "excerpt_found": true,
     "page_match": true,
     "numbers_supported": true,
     "identity": true
    },
    "notes": [],
    "verified_at": "2026-10-26T02:21:20+00:00"
   }
  },
  {
   "id": "7418-PS-06",
   "field": "products",
   "statement": "本公司代理的日本餐飲品牌包括「金子半之助」、「つじ半海鮮丼」及「名代 宇奈とと」等。",
   "period": "截至115年度公開說明書刊印日",
   "page": 35,
   "excerpts": [
    "並代理日本\n知名餐飲品牌「金子半之助」、「つじ半海鮮丼」及「名代 宇奈とと」"
   ],
   "attribution": "公司公開說明書揭露",
   "verification": {
    "status": "PASS",
    "checks": {
     "source_hash": true,
     "excerpt_found": true,
     "page_match": true,
     "numbers_supported": true,
     "identity": true
    },
    "notes": [],
    "verified_at": "2026-10-26T02:21:20+00:00"
   }
  },
  {
   "id": "7418-PS-07",
   "field": "business_scope",
   "statement": "本集團在中國及臺灣採直營與加盟並行模式，其他區域則以代理與加盟並行模式拓展連鎖事業。",
   "period": "截至115年度公開說明書刊印日",
   "page": 35,
   "excerpts": [
    "並採取直營與加盟並行的模式於中國及臺灣市場\n拓展 ， 中國及臺灣以外區域則以代理方式與加盟並行模式拓展連鎖事業版圖 。"
   ],
   "attribution": "公司公開說明書揭露",
   "verification": {
    "status": "PASS",
    "checks": {
     "source_hash": true,
     "excerpt_found": true,
     "page_match": true,
     "numbers_supported": true,
     "identity": true
    },
    "notes": [],
    "verified_at": "2026-10-26T02:21:20+00:00"
   }
  },
  {
   "id": "7418-PS-08",
   "field": "sales_regions",
   "statement": "114年度本集團內銷銷售額為新臺幣995,287千元，占銷售淨額合計58.77%。",
   "period": "114年度",
   "page": 43,
   "excerpts": [
    "(1)主要商品(服務)之銷售(提供)地區 \n單位：新臺幣千元；% \n年度 \n地區別 \n113年度 114 年度 \n銷售額 比率(%) 銷售額 比率(%)",
    "內銷 914,808 58.57 995,287 58.77",
    "銷售淨額合計 1,561,981 100.00 1,693,507 100.00"
   ],
   "attribution": "公司公開說明書揭露",
   "verification": {
    "status": "PASS",
    "checks": {
     "source_hash": true,
     "excerpt_found": true,
     "page_match": true,
     "numbers_supported": true,
     "identity": true
    },
    "notes": [],
    "verified_at": "2026-10-26T02:21:20+00:00"
   }
  },
  {
   "id": "7418-PS-09",
   "field": "sales_regions",
   "statement": "114年度本集團中國地區外銷銷售額為新臺幣638,326千元，占銷售淨額合計37.69%。",
   "period": "114年度",
   "page": 43,
   "excerpts": [
    "(1)主要商品(服務)之銷售(提供)地區 \n單位：新臺幣千元；% \n年度 \n地區別 \n113年度 114 年度 \n銷售額 比率(%) 銷售額 比率(%)",
    "外銷 中國 594,742 38.08 638,326 37.69",
    "銷售淨額合計 1,561,981 100.00 1,693,507 100.00"
   ],
   "attribution": "公司公開說明書揭露",
   "verification": {
    "status": "PASS",
    "checks": {
     "source_hash": true,
     "excerpt_found": true,
     "page_match": true,
     "numbers_supported": true,
     "identity": true
    },
    "notes": [],
    "verified_at": "2026-10-26T02:21:20+00:00"
   }
  },
  {
   "id": "7418-PS-10",
   "field": "major_suppliers",
   "statement": "114年度本集團向山東鳳祥實業有限公司進貨新臺幣61,292千元，占全年度進貨淨額12.68%，該供應商與發行人無關係。",
   "period": "114年度",
   "page": 47,
   "excerpts": [
    "單位：新臺幣千元；% \n年度 113 年度 114 年度 \n項目 名稱 金額 占全年度進\n貨淨額比率 \n與發行人\n之關係 名稱 金額 占全年度進\n貨淨額比率 \n與發行人\n之關係",
    "1 山東鳳祥實\n業有限公司 78,748 14.30 無 山東鳳祥實\n業有限公司 61,292 12.68 無"
   ],
   "attribution": "公司公開說明書揭露",
   "verification": {
    "status": "PASS",
    "checks": {
     "source_hash": true,
     "excerpt_found": true,
     "page_match": true,
     "numbers_supported": true,
     "identity": true
    },
    "notes": [],
    "verified_at": "2026-10-26T02:21:20+00:00"
   }
  },
  {
   "id": "7418-PS-11",
   "field": "major_customers",
   "statement": "最近二年度，本集團無占銷貨總額百分之十以上之客戶。",
   "period": "最近二年度",
   "page": 47,
   "excerpts": [
    "本集團主要銷貨對象係為加盟店及一般消費者，最近二年度並無占銷貨\n總額百分之十以上之客戶。"
   ],
   "attribution": "公司公開說明書揭露",
   "verification": {
    "status": "PASS",
    "checks": {
     "source_hash": true,
     "excerpt_found": true,
     "page_match": true,
     "numbers_supported": true,
     "identity": true
    },
    "notes": [],
    "verified_at": "2026-10-26T02:21:20+00:00"
   }
  },
  {
   "id": "7418-PS-12",
   "field": "raw_materials",
   "statement": "本集團餐飲原料包括肉類、海鮮、油品及蔬果等食材。",
   "period": "截至115年度公開說明書刊印日",
   "page": 46,
   "excerpts": [
    "本集團餐飲主要包含肉類、海鮮、油品、蔬果等食材"
   ],
   "attribution": "公司公開說明書揭露",
   "verification": {
    "status": "PASS",
    "checks": {
     "source_hash": true,
     "excerpt_found": true,
     "page_match": true,
     "numbers_supported": true,
     "identity": true
    },
    "notes": [],
    "verified_at": "2026-10-26T02:21:20+00:00"
   }
  },
  {
   "id": "7418-PS-13",
   "field": "market_position",
   "statement": "公司於公開說明書自述，114年以本公司營業收入占臺灣餐館業營業額計算的市場占有率為0.20%，分母資料來源為經濟部統計處。",
   "period": "114年",
   "page": 43,
   "excerpts": [
    "(2)市場占有率 \n單位：新臺幣千元；% \n項目 113 年 114 年 \n臺灣餐館業營業額(A) 838,746,437 853,299,576 \n本公司營業收入(B) 1,561,981 1,693,507 \n本公司市場占有率(%)(B/A) 0.19% 0.20% \n資料來源：經濟部統計處。"
   ],
   "attribution": "公司公開說明書自述（未經獨立驗證的排名或評價）",
   "verification": {
    "status": "PASS",
    "checks": {
     "source_hash": true,
     "excerpt_found": true,
     "page_match": true,
     "numbers_supported": true,
     "identity": true
    },
    "notes": [],
    "verified_at": "2026-10-26T02:21:20+00:00"
   }
  },
  {
   "id": "7418-PS-14",
   "field": "employees",
   "statement": "截至115年5月31日，從業員工人數表合計為663人（員工人數表未載明為母公司或合併範圍）。",
   "period": "115年截至5月31日",
   "page": 48,
   "excerpts": [
    "(三)最近二年度從業員工人數 \n單位：人；% \n年   度 113 年度 114 年度 115年截至 \n5月31日",
    "合    計 644 678 663"
   ],
   "attribution": "公司公開說明書揭露",
   "verification": {
    "status": "PASS",
    "checks": {
     "source_hash": true,
     "excerpt_found": true,
     "page_match": true,
     "numbers_supported": true,
     "identity": true
    },
    "notes": [],
    "verified_at": "2026-10-26T02:21:20+00:00"
   }
  },
  {
   "id": "7418-PS-15",
   "field": "rd",
   "statement": "本公司未設立專職研發單位，研發事務由產品規劃部同仁統籌規劃、餐飲品質精進與新產品開發工作。",
   "period": "截至115年度公開說明書刊印日",
   "page": 40,
   "excerpts": [
    "本公司未設立專職研發單位，研發事務係由產品規劃部同仁負責統籌規\n劃、餐飲品質精進與新產品開發工作。"
   ],
   "attribution": "公司公開說明書揭露",
   "verification": {
    "status": "PASS",
    "checks": {
     "source_hash": true,
     "excerpt_found": true,
     "page_match": true,
     "numbers_supported": true,
     "identity": true
    },
    "notes": [],
    "verified_at": "2026-10-26T02:21:20+00:00"
   }
  },
  {
   "id": "7418-PS-16",
   "field": "rd",
   "statement": "113年度及114年度，本公司研發相關人員薪資及物料測試費用過往由各品牌營運及後勤單位共同分攤，帳面上無獨立編列之研發費用。",
   "period": "113年度及114年度",
   "page": 10,
   "excerpts": [
    "本公司研發係由產品規劃部負責統籌規劃、餐飲品質精進與新產品開發工\n作，所產生之相關人員薪資及物料測試費用，因過往實務上係由各品牌營運及後\n勤單位共同分攤，故 113 年度及 114 年度帳面上尚無實際發生獨立編列之研發\n費用。"
   ],
   "attribution": "公司公開說明書揭露",
   "verification": {
    "status": "PASS",
    "checks": {
     "source_hash": true,
     "excerpt_found": true,
     "page_match": true,
     "numbers_supported": true,
     "identity": true
    },
    "notes": [],
    "verified_at": "2026-10-26T02:21:20+00:00"
   }
  },
  {
   "id": "7418-PS-17",